{
  "$schema": "https://json-schema.org/draft/2020-12/schema",
  "$id": "https://raw.githubusercontent.com/carrick-org/carrick-protocol/v0.9/schemas/connections.schema.json",
  "title": "Carrick connections file",
  "description": "The list of the owner's connections that moves with them: addresses, names and kinds only. No credential, token, key, or hash of one. See spec/5-moving.md (section 5.6).",
  "type": "object",
  "required": [
    "protocol",
    "owner",
    "peers_in",
    "peers_out"
  ],
  "properties": {
    "protocol": {
      "enum": ["carrick/1", "lodestone/1"]
    },
    "owner": {
      "type": "string"
    },
    "peers_in": {
      "description": "People whose servers read from the owner; re-invited after a move.",
      "type": "array",
      "items": {
        "type": "object",
        "required": [
          "url"
        ],
        "properties": {
          "url": {
            "type": "string"
          },
          "owner": {
            "type": "string"
          },
          "person": {
            "type": "string"
          }
        },
        "additionalProperties": false
      }
    },
    "peers_out": {
      "type": "array",
      "items": {
        "type": "object",
        "required": [
          "url",
          "kind"
        ],
        "properties": {
          "url": {
            "type": "string"
          },
          "kind": {
            "enum": [
              "peer",
              "publication"
            ]
          },
          "slug": {
            "type": "string"
          },
          "owner": {
            "type": "string"
          }
        },
        "additionalProperties": false
      }
    },
    "apps": {
      "description": "Apps the owner had connected, for a sign-in checklist.",
      "type": "array",
      "items": {
        "type": "object",
        "required": [
          "name"
        ],
        "properties": {
          "name": {
            "type": "string"
          }
        },
        "additionalProperties": false
      }
    }
  },
  "additionalProperties": false
}
