{
  "protocol": "carrick/1",
  "owner": "https://alex.old-provider.example",
  "peers_in": [
    {
      "url": "https://sam.example",
      "owner": "Sam",
      "person": "sam"
    }
  ],
  "peers_out": [
    {
      "url": "https://jo.example",
      "kind": "peer",
      "owner": "Jo"
    },
    {
      "url": "https://news.example",
      "kind": "publication",
      "slug": "garden-notes",
      "owner": "News"
    }
  ],
  "apps": [
    {
      "name": "Claude"
    },
    {
      "name": "VS Code"
    }
  ]
}
